story_id,story_section,claim,key_metric,key_result,why_it_matters,scope_boundary,source_artifact
S1,Main real-record result,FailureOps finds paired intervention-sensitive logical failure behavior on real QEC detector records.,holm-significant real decoder-pathway conditions,39/40;net_rescuing=40/40,Treats logical failure as an intervention-sensitive system event on public shot-level records.,Evidence uses one public Google RL QEC dataset family rather than independent hardware campaigns.,data/results/p10_effect_significance.csv
S2,Methodology necessity,Pairing is methodologically necessary because it reduces estimator variance and exposes rescued/induced transitions.,mean unpaired/paired bootstrap std ratio on original and expanded corpora,orig=1.754761;v2=1.783838,"Shows that pairing is a measurement requirement, not just an implementation detail.",Bootstrap does not replace external replication.,data/results/p7_5_paired_vs_unpaired_variance.csv;data/results/p10_google_rl_qec_v2_paired_vs_unpaired_variance.csv
S3,Baseline semantics gap,Static burden and plain LFR baselines do not provide intervention attribution.,baseline-vs-FailureOps ranking agreement plus missing rescued/induced semantics,plain_lfr_spearman=0.962664;static_spearman=0.949906,Separates ranking difficult conditions from attributing which controllable factor changed failure behavior.,Ranking agreement can be high because difficult conditions also have larger intervention effects.,data/results/p10_baseline_comparison.csv
S4,Runtime replay closure,Measured decoder-runtime replay can be closed into paired runtime deadline interventions.,deadline-induced paired delta logical-failure rate,4us_miss=0.936000;4us_delta=0.307200;7us_delta=0.000000,Connects measured decoder service time to a runtime intervention that changes logical outcomes on the same shots.,"Replay measures local decoder service time, not live control-stack queueing or hardware feedback latency.",data/results/p10_runtime_deadline_summary.csv
S5,External real-record replication,The real-record decoder-pathway sensitivity result externally replicates on the qec3v5 public surface-code scaling dataset.,holm-significant qec3v5 decoder-pathway conditions,23/26,Shows that the main paired decoder-pathway result is not confined to one Google RL QEC release.,qec3v5 is a separate public experiment dataset but still from Google.,data/results/p10_qec3v5_external_decoder_effect_matrix.csv
S6,Expanded same-family stability,"The paired logical-failure sensitivity signal remains broadly net-rescuing on the broader Google RL QEC v2 same-family corpus, including both observed control modes and both logical bases.","net-rescuing fraction, subgroup means, and scope-wise Holm count on the v2 corpus",net_rescuing=461/496;holm_significant=273/496;traditional_mean=-0.014388;fine_tuning_mean=-0.012934;X_mean=-0.011489;Z_mean=-0.015833;all_mean=-0.013661,Strengthens the story from a focused public matrix to a broader same-family real-record corpus without changing the thesis.,The v2 expansion broadens the Google public corpus but is not an independent non-Google replication.,data/results/p10_google_rl_qec_v2_decoder_effect_matrix.csv
S7,Corpus-level prior interventions,FailureOps scales from a focused prior sweep to a corpus-level prior intervention study on public detector records.,bootstrap-CI support rate plus mean paired delta by prior family,ci_nonzero=4879/5724;means=dem_correlations=-0.013326;dem_rl_isolated_correlated_matching=-0.021166;dem_rl_shared_correlated_matching=-0.018025,Turns decoder-prior analysis into a systems-style intervention family rather than a single anecdotal condition.,"The current prior corpus is same-family Google public evidence with a fixed decoder backend, not an independent cross-lab prior replication.",data/results/p10_google_decoder_priors_prior_effects.csv
