claim_id,claim,evidence_status,primary_metric,observed_value,pass_criterion,passes,limitation,no_hardware_resolution,source_artifact
C1,FailureOps finds paired intervention-sensitive logical failure behavior on real QEC detector records.,supported,holm-significant real decoder-pathway conditions,37/40,"at least 90% of observed real-data conditions significant after Holm correction, with all conditions net-rescuing",True,Evidence uses one public Google RL QEC dataset family rather than independent hardware campaigns.,Use all public conditions as paired records; state dataset-family boundary explicitly.,data/results/p10_effect_significance.csv
C2,Pairing is methodologically necessary because it reduces estimator variance and exposes rescued/induced transitions.,supported,mean unpaired/paired bootstrap std ratio,1.754761,ratio > 1.0 across observed conditions,True,Bootstrap does not replace external replication.,Report paired-vs-unpaired estimator comparison over the same public shot records.,data/results/p10_realdata_robustness.csv
C3,Static burden and plain LFR baselines do not provide intervention attribution.,supported_with_caveat,baseline ranking agreement vs FailureOps,static_spearman=0.949906;plain_lfr_spearman=0.962664,baselines lack rescued/induced paired transition fields even when rankings correlate,True,Ranking agreement can be high because difficult conditions also have larger intervention effects.,"Frame baselines as missing attribution semantics, not as universally inaccurate predictors.",data/results/p10_baseline_comparison.csv
C4,Measured decoder-runtime replay can be closed into paired runtime deadline interventions.,supported_as_replay,max absolute deadline-induced paired delta LFR,0.307200,at least one measured-runtime deadline has Holm-significant paired effect,True,"Replay measures local decoder service time, not live control-stack queueing or hardware feedback latency.","Call this measured-runtime replay, and do not claim live hardware runtime attribution.",data/results/p10_runtime_deadline_summary.csv
C5,The current artifact is ready for a EuroSys main-track systems story without claiming live-hardware runtime traces.,partially_supported,explicit realness boundary plus robustness checks,negative_delta_fraction=1.000000;runtime_replay_claim_only=true,"paper claims are limited to public real detector records, measured replay, and controlled proxy experiments",True,"No true machine means no live feedback, no production queue traces, and no hardware-control timing attribution.",Position contribution as paired FailureOps methodology plus public real-record evaluation; list live trace collection as future work.,data/results/p10_claim_audit.csv
C6,The real-record decoder-pathway sensitivity result externally replicates on the qec3v5 public surface-code scaling dataset.,supported,holm-significant qec3v5 decoder-pathway conditions,23/26,at least 80% of qec3v5 conditions significant after Holm correction and no condition net-inducing,True,qec3v5 is a separate public experiment dataset but still from Google.,Use it as external dataset replication while keeping independent-lab claims separate.,data/results/p10_qec3v5_external_decoder_effect_matrix.csv
C6b,The paired logical-failure sensitivity result extends to the broader Google RL QEC v2 real-record corpus across additional placements and control modes.,supported,holm-significant Google RL QEC v2 decoder-pathway conditions,272/496,at least 80% of v2 conditions significant after Holm correction and all conditions net-rescuing,False,The v2 expansion broadens the Google public corpus but is not an independent non-Google replication.,Use it as expanded same-family real-record evidence while keeping independent-lab claims separate.,data/results/p10_google_rl_qec_v2_decoder_effect_matrix.csv
C7,Independent non-Google public QEC datasets support boundary checks but not shot-level FailureOps attribution.,boundary_supported,independent dataset compatibility,daqec_delta=-0.000201;eth_units=20,independent data inspected and classified by FailureOps compatibility,True,"DAQEC is aggregate/session-level and ETH 2020 is figure-level CSV, so neither is a P7-style shot-level detector-record intervention.","Use independent datasets as bounded sanity evidence, not as the main paired real-record replication.",data/results/p10_external_sanity_checks.csv
