claim_id,paper_claim,evidence_source,metric,value,interpretation,limitation,citation_artifact
C1,FailureOps computes paired counterfactual decoder-pathway sensitivity on real QEC detector records.,P7/P7.5 real detector records,mean paired_delta_lfr over all conditions,-0.019492,40 real-data conditions and 400000 valid pairs show intervention-sensitive logical failure behavior.,"This is decoder-pathway sensitivity, not live hardware runtime attribution.",data/results/p7_google_rl_qec_decoder_effect_matrix.csv
C2,Paired counterfactual evaluation reduces estimator variance relative to unpaired resampling.,P7.5 paired-vs-unpaired bootstrap,mean std_ratio_unpaired_over_paired,1.754761,Unpaired bootstrap estimates have higher delta-LFR variance on the same real records.,Bootstrap variance is not a formal end-to-end causal proof.,data/results/p7_5_paired_vs_unpaired_variance.csv
C3,Rescued and induced shots have measurable detector-record profiles.,P7.5 rescue/induction feature summary,rescued_vs_induced_detector_count,rescued=109.354071;induced=111.999684,Transition classes can be described by detector-event count and burst features.,"These are descriptive shot profiles, not standalone attribution without intervention.",data/results/p7_5_rescue_induction_features.csv
C4,Decoder-prior changes can be represented as paired interventions over the same real detector records.,P7.5 decoder-prior interventions,largest prior-induced delta_lfr,0.015900,Largest observed prior regression: pymatching_flatten_log_odds_50pct.,Current prior sweep is a focused single-condition analysis.,data/results/p7_5_decoder_prior_interventions.csv
C5,FailureOps can ingest measured decoder-runtime replay evidence without a live device.,P8 measured PyMatching replay,mean and p95 measured per-shot decode time,mean_us=4.654311;p95_us=5.642766,Runtime evidence is measured decoder service time on real detector records.,"This is offline decoder replay, not live control-stack timing.",data/results/p8_decoder_runtime_summary.csv
